,id,title,overview,release_date,popularity,vote_average,vote_count
0,1519340,Jangan Buang Ibu,"An emotional family story exploring sacrifice, motherhood, and redemption across generations.",2026-05-03,73.8,0,0
1,1574961,Warkop DKI Viralin Doooong,"A chaotic comedy adventure inspired by the legendary Warkop DKI humor style in the modern social media era.",2026-06-14,88.5,0,0
2,1571891,Nobody Loves Kay,"A young woman struggles with loneliness and identity while trying to reconnect with the people around her.",2026-07-05,71.9,0,0
3,1081003,Supergirl: Woman of Tomorrow,"DC superhero film following Supergirl’s journey.",2026-06-26,60.3,0,0
4,1084244,Toy Story 5,"Pixar’s continuation of the beloved franchise.",2026-06-19,75.2,0,0
5,1212763,Evil Dead Burn,"Upcoming horror from Warner Bros with modern take.",2026-07-24,55.4,0,0
6,969681,Spider-Man: Brand New Day,"New Spider-Man chapter continuing the MCU tale.",2026-07-31,85.9,0,0
7,1275779,Disclosure Day,"Sci-fi adventure from director Spielberg",2026-06-12,68.9,0,0